<?xml version="1.0"?>
<!DOCTYPE application SYSTEM "http://dione.zcu.cz/~toman40/ActionServlet/dtd/ActionServlet_0_85.dtd">

<application>
   <templates>
      <template name="form.wm" is-new-session="true"/>

      <template name="allguest.wm">
         <output-variable name="registry" component="GuestBook" value="book"/>
      </template>
   </templates>

   <type-handlers>
      <type-handler type="Email" class="EmailHandler"/>
   </type-handlers>

   <components>
      <component name="GuestBook" class="GuestBook" persistence="application">
         <action name="show" method="show(String target)"/>
         <action name="SUBMIT" method="verify(Email email)">
            <on-return value="void" show-template="verify.wm"/>
         </action>
         <action name="PROCEED" method="proceed(String name, Email email, String comment)">
            <on-return value="void" show-template="allguest.wm"/>
         </action>
      </component>
   </components>
</application>
